{
  "$schema": "https://json-schema.org/draft/2020-12/schema",
  "$id": "urn:medp:spec:v0",
  "title": "Machine-Executable Domain Package descriptor",
  "description": "A deliberately small descriptor for machine-executable domain packages. It binds native artifacts, expected observations, proposed effects, validation criteria, provenance, and external authority expectations without granting authority itself.",
  "type": "object",
  "additionalProperties": false,
  "required": [
    "medp_version",
    "package",
    "native_artifacts",
    "interfaces",
    "observations",
    "capabilities",
    "validation",
    "dependencies",
    "authority",
    "provenance"
  ],
  "properties": {
    "$schema": {
      "type": "string"
    },
    "medp_version": {
      "const": "0"
    },
    "package": {
      "$ref": "#/$defs/package"
    },
    "native_artifacts": {
      "type": "array",
      "minItems": 1,
      "items": {
        "$ref": "#/$defs/nativeArtifact"
      }
    },
    "interfaces": {
      "type": "array",
      "minItems": 1,
      "items": {
        "$ref": "#/$defs/interface"
      }
    },
    "observations": {
      "$ref": "#/$defs/observations"
    },
    "expected_user_inputs": {
      "type": "array",
      "items": {
        "$ref": "#/$defs/userInput"
      }
    },
    "capabilities": {
      "type": "array",
      "minItems": 1,
      "items": {
        "$ref": "#/$defs/capability"
      }
    },
    "validation": {
      "type": "array",
      "minItems": 1,
      "items": {
        "$ref": "#/$defs/validation"
      }
    },
    "dependencies": {
      "$ref": "#/$defs/dependencies"
    },
    "authority": {
      "$ref": "#/$defs/authority"
    },
    "provenance": {
      "$ref": "#/$defs/provenance"
    }
  },
  "allOf": [
    {
      "if": {
        "properties": {
          "package": {
            "properties": {
              "kind": {
                "const": "organization_policy"
              }
            },
            "required": [
              "kind"
            ]
          }
        }
      },
      "then": {
        "properties": {
          "package": {
            "properties": {
              "knowledge_scope": {
                "const": "organization"
              }
            },
            "required": [
              "knowledge_scope"
            ]
          }
        }
      }
    },
    {
      "if": {
        "properties": {
          "package": {
            "properties": {
              "kind": {
                "const": "software"
              }
            },
            "required": [
              "kind"
            ]
          }
        }
      },
      "then": {
        "properties": {
          "package": {
            "properties": {
              "knowledge_scope": {
                "const": "community"
              }
            },
            "required": [
              "knowledge_scope"
            ]
          }
        }
      }
    },
    {
      "if": {
        "properties": {
          "package": {
            "properties": {
              "kind": {
                "const": "deployment"
              }
            },
            "required": [
              "kind"
            ]
          }
        }
      },
      "then": {
        "properties": {
          "package": {
            "properties": {
              "knowledge_scope": {
                "enum": [
                  "provider",
                  "community"
                ]
              }
            },
            "required": [
              "knowledge_scope"
            ]
          }
        }
      }
    }
  ],
  "$defs": {
    "identifier": {
      "type": "string",
      "pattern": "^[a-z0-9]+(?:[._-][a-z0-9]+)*(?:/[a-z0-9]+(?:[._-][a-z0-9]+)*)*$"
    },
    "semver": {
      "type": "string",
      "pattern": "^(0|[1-9]\\d*)\\.(0|[1-9]\\d*)\\.(0|[1-9]\\d*)(?:-[0-9A-Za-z.-]+)?(?:\\+[0-9A-Za-z.-]+)?$"
    },
    "uriLike": {
      "type": "string",
      "minLength": 1
    },
    "publisher": {
      "type": "object",
      "additionalProperties": false,
      "required": [
        "name",
        "scope"
      ],
      "properties": {
        "name": {
          "type": "string",
          "minLength": 1
        },
        "scope": {
          "enum": [
            "community",
            "provider",
            "organization"
          ]
        }
      }
    },
    "package": {
      "type": "object",
      "additionalProperties": false,
      "required": [
        "id",
        "name",
        "version",
        "kind",
        "knowledge_scope",
        "summary",
        "publisher"
      ],
      "properties": {
        "id": {
          "$ref": "#/$defs/identifier"
        },
        "name": {
          "type": "string",
          "minLength": 1
        },
        "version": {
          "$ref": "#/$defs/semver"
        },
        "kind": {
          "enum": [
            "software",
            "deployment",
            "organization_policy"
          ]
        },
        "knowledge_scope": {
          "enum": [
            "community",
            "provider",
            "organization"
          ]
        },
        "summary": {
          "type": "string",
          "minLength": 1
        },
        "publisher": {
          "$ref": "#/$defs/publisher"
        },
        "license": {
          "type": "string",
          "minLength": 1
        }
      }
    },
    "nativeArtifact": {
      "type": "object",
      "additionalProperties": false,
      "required": [
        "id",
        "kind",
        "location"
      ],
      "properties": {
        "id": {
          "$ref": "#/$defs/identifier"
        },
        "kind": {
          "enum": [
            "openrewrite_recipe",
            "rego_bundle",
            "json_schema",
            "cli",
            "library",
            "container_image",
            "document",
            "other"
          ]
        },
        "location": {
          "$ref": "#/$defs/uriLike"
        },
        "integrity": {
          "type": "string",
          "pattern": "^[A-Za-z0-9_-]+:[A-Fa-f0-9]{16,}$"
        },
        "notes": {
          "type": "string"
        }
      }
    },
    "interface": {
      "type": "object",
      "additionalProperties": false,
      "required": [
        "kind",
        "target",
        "contract_ref"
      ],
      "properties": {
        "kind": {
          "enum": [
            "cli",
            "library",
            "mcp",
            "http",
            "container",
            "file"
          ]
        },
        "target": {
          "type": "string",
          "minLength": 1
        },
        "contract_ref": {
          "$ref": "#/$defs/identifier"
        },
        "notes": {
          "type": "string"
        }
      }
    },
    "observations": {
      "type": "object",
      "additionalProperties": false,
      "required": [
        "required",
        "optional",
        "missing_behavior"
      ],
      "properties": {
        "required": {
          "type": "array",
          "items": {
            "$ref": "#/$defs/identifier"
          },
          "uniqueItems": true
        },
        "optional": {
          "type": "array",
          "items": {
            "$ref": "#/$defs/identifier"
          },
          "uniqueItems": true
        },
        "missing_behavior": {
          "enum": [
            "blocked",
            "unsupported",
            "unknown"
          ]
        }
      }
    },
    "userInput": {
      "type": "object",
      "additionalProperties": false,
      "required": [
        "id",
        "description",
        "required"
      ],
      "properties": {
        "id": {
          "$ref": "#/$defs/identifier"
        },
        "description": {
          "type": "string",
          "minLength": 1
        },
        "required": {
          "type": "boolean"
        }
      }
    },
    "capability": {
      "type": "object",
      "additionalProperties": false,
      "required": [
        "id",
        "kind",
        "summary",
        "native_refs",
        "effects",
        "requires_observations",
        "unsupported_cases",
        "required_rights",
        "validator_refs"
      ],
      "properties": {
        "id": {
          "$ref": "#/$defs/identifier"
        },
        "kind": {
          "enum": [
            "analysis",
            "transform",
            "plan",
            "policy",
            "validator"
          ]
        },
        "summary": {
          "type": "string",
          "minLength": 1
        },
        "native_refs": {
          "type": "array",
          "minItems": 1,
          "items": {
            "$ref": "#/$defs/identifier"
          },
          "uniqueItems": true
        },
        "effects": {
          "type": "array",
          "minItems": 1,
          "items": {
            "enum": [
              "report_only",
              "source_edit",
              "configuration_edit",
              "dependency_change",
              "deployment_plan",
              "policy_decision",
              "validation_result"
            ]
          },
          "uniqueItems": true
        },
        "requires_observations": {
          "type": "array",
          "items": {
            "$ref": "#/$defs/identifier"
          },
          "uniqueItems": true
        },
        "unsupported_cases": {
          "type": "array",
          "items": {
            "type": "string",
            "minLength": 1
          }
        },
        "required_rights": {
          "type": "array",
          "items": {
            "enum": [
              "admit_evidence",
              "adopt_rule",
              "evaluate_policy",
              "choose",
              "authorize_change",
              "execute",
              "attest_check",
              "accept_result",
              "issue_exception",
              "delegate"
            ]
          },
          "uniqueItems": true
        },
        "validator_refs": {
          "type": "array",
          "items": {
            "$ref": "#/$defs/identifier"
          },
          "uniqueItems": true
        }
      }
    },
    "validation": {
      "type": "object",
      "additionalProperties": false,
      "required": [
        "id",
        "kind",
        "summary",
        "native_refs",
        "result_states"
      ],
      "properties": {
        "id": {
          "$ref": "#/$defs/identifier"
        },
        "kind": {
          "enum": [
            "build",
            "test",
            "policy",
            "schema",
            "runtime",
            "other"
          ]
        },
        "summary": {
          "type": "string",
          "minLength": 1
        },
        "native_refs": {
          "type": "array",
          "minItems": 1,
          "items": {
            "$ref": "#/$defs/identifier"
          },
          "uniqueItems": true
        },
        "result_states": {
          "type": "array",
          "minItems": 1,
          "items": {
            "enum": [
              "pass",
              "fail",
              "error",
              "not_run",
              "skipped",
              "unknown"
            ]
          },
          "uniqueItems": true
        }
      }
    },
    "packageDependency": {
      "type": "object",
      "additionalProperties": false,
      "required": [
        "id",
        "version_range",
        "reason"
      ],
      "properties": {
        "id": {
          "$ref": "#/$defs/identifier"
        },
        "version_range": {
          "type": "string",
          "minLength": 1
        },
        "reason": {
          "type": "string",
          "minLength": 1
        }
      }
    },
    "engineDependency": {
      "type": "object",
      "additionalProperties": false,
      "required": [
        "name",
        "version_range",
        "role"
      ],
      "properties": {
        "name": {
          "type": "string",
          "minLength": 1
        },
        "version_range": {
          "type": "string",
          "minLength": 1
        },
        "role": {
          "enum": [
            "analysis",
            "transform",
            "policy",
            "validation",
            "execution"
          ]
        }
      }
    },
    "dependencies": {
      "type": "object",
      "additionalProperties": false,
      "required": [
        "packages",
        "engines"
      ],
      "properties": {
        "packages": {
          "type": "array",
          "items": {
            "$ref": "#/$defs/packageDependency"
          }
        },
        "engines": {
          "type": "array",
          "items": {
            "$ref": "#/$defs/engineDependency"
          }
        }
      }
    },
    "authority": {
      "type": "object",
      "additionalProperties": false,
      "required": [
        "self_authorizing",
        "required_external_bindings",
        "notes"
      ],
      "properties": {
        "self_authorizing": {
          "const": false
        },
        "required_external_bindings": {
          "type": "array",
          "minItems": 1,
          "items": {
            "enum": [
              "user_intent",
              "authority_profile",
              "execution_gate",
              "approval_record",
              "policy_engine"
            ]
          },
          "uniqueItems": true
        },
        "notes": {
          "type": "string",
          "minLength": 1
        }
      }
    },
    "provenanceSource": {
      "type": "object",
      "additionalProperties": false,
      "required": [
        "name",
        "uri",
        "retrieved_on"
      ],
      "properties": {
        "name": {
          "type": "string",
          "minLength": 1
        },
        "uri": {
          "$ref": "#/$defs/uriLike"
        },
        "retrieved_on": {
          "type": "string",
          "pattern": "^\\d{4}-\\d{2}-\\d{2}$"
        }
      }
    },
    "provenanceArtifact": {
      "type": "object",
      "additionalProperties": false,
      "required": [
        "name",
        "locator"
      ],
      "properties": {
        "name": {
          "type": "string",
          "minLength": 1
        },
        "locator": {
          "$ref": "#/$defs/uriLike"
        },
        "digest": {
          "type": "string",
          "pattern": "^[A-Za-z0-9_-]+:[A-Fa-f0-9]{16,}$"
        }
      }
    },
    "provenance": {
      "type": "object",
      "additionalProperties": false,
      "required": [
        "sources",
        "artifacts"
      ],
      "properties": {
        "sources": {
          "type": "array",
          "minItems": 1,
          "items": {
            "$ref": "#/$defs/provenanceSource"
          }
        },
        "artifacts": {
          "type": "array",
          "items": {
            "$ref": "#/$defs/provenanceArtifact"
          }
        }
      }
    }
  }
}
